{
  "schema_version": "0.2",
  "config_type": "event-aware-anomaly-matrix",
  "matrix_id": "anomaly-multiseed-v02",
  "base_generator_config_path": "examples/configs/synthetic-anomaly-evaluation-v0.1.json",
  "base_generator_config_canonical_sha256": "16165735d4fdb71213fec301f26d9c04a593ee36afbb51d255be535dd98f8b93",
  "base_generator_schema_path": "schemas/synthetic-generator-config.schema.json",
  "base_generator_schema_canonical_sha256": "e6e743ef4cb28902b3869cf20a0227df0340fe6b6ce0227d63eb2d2b0b55fd89",
  "schema_path": "schemas/anomaly-multiseed-matrix-config-v0.2.schema.json",
  "schema_canonical_sha256": "fd0308a66a03b8d164dfa16584286b6f686080d830ab6edce36280c2949c2e97",
  "seeds": [
    11,
    17,
    23,
    29,
    37,
    42,
    53,
    67,
    79,
    97
  ],
  "test_split": {
    "start_sample": 720,
    "end_sample": 900
  },
  "mode_window_samples": 30,
  "slot_offsets_samples": [
    2,
    9,
    16,
    23
  ],
  "event_duration_samples": 3,
  "expanded_window_grace_points": 3,
  "targets": [
    "motor_current",
    "motor_temperature",
    "conveyor_speed",
    "vibration_feature"
  ],
  "detector": {
    "min_calibration_points": 10,
    "robust_z_threshold": 4,
    "persistence_points": 2,
    "detection_grace_points": 3
  },
  "bootstrap": {
    "seed": 20260905,
    "resamples": 10000,
    "confidence_level": 0.95
  },
  "output_root": "artifacts/anomaly-multiseed-v02",
  "layouts": [
    {
      "layout_id": "motor-01-stopped",
      "layout_index": 0,
      "equipment_id": "motor-01",
      "operating_mode": "stopped",
      "mode_start_sample": 720,
      "mode_end_sample": 750,
      "events": [
        {
          "event_id": "motor-01-stopped-machine-fault",
          "event_class": "machine_fault",
          "event_type": "jam_or_slip",
          "signal_id": "motor_current",
          "magnitude": 0.55,
          "enabled": true,
          "start_offset_samples": 2,
          "duration_samples": 3
        },
        {
          "event_id": "motor-01-stopped-sensor-fault",
          "event_class": "sensor_fault",
          "event_type": "spike",
          "signal_id": "motor_temperature",
          "magnitude": 8,
          "enabled": true,
          "start_offset_samples": 9,
          "duration_samples": 3
        },
        {
          "event_id": "motor-01-stopped-data-quality",
          "event_class": "data_quality",
          "event_type": "dropout",
          "signal_id": "motor_temperature",
          "magnitude": 0,
          "enabled": true,
          "start_offset_samples": 16,
          "duration_samples": 3
        },
        {
          "event_id": "motor-01-stopped-ignored",
          "event_class": "ignored",
          "event_type": "stuck_value",
          "signal_id": "load_proxy",
          "magnitude": 0,
          "enabled": true,
          "start_offset_samples": 23,
          "duration_samples": 3
        }
      ]
    },
    {
      "layout_id": "motor-01-startup",
      "layout_index": 1,
      "equipment_id": "motor-01",
      "operating_mode": "startup",
      "mode_start_sample": 750,
      "mode_end_sample": 780,
      "events": [
        {
          "event_id": "motor-01-startup-machine-fault",
          "event_class": "machine_fault",
          "event_type": "jam_or_slip",
          "signal_id": "motor_current",
          "magnitude": 0.55,
          "enabled": true,
          "start_offset_samples": 9,
          "duration_samples": 3
        },
        {
          "event_id": "motor-01-startup-sensor-fault",
          "event_class": "sensor_fault",
          "event_type": "spike",
          "signal_id": "motor_temperature",
          "magnitude": 8,
          "enabled": true,
          "start_offset_samples": 16,
          "duration_samples": 3
        },
        {
          "event_id": "motor-01-startup-data-quality",
          "event_class": "data_quality",
          "event_type": "dropout",
          "signal_id": "motor_temperature",
          "magnitude": 0,
          "enabled": true,
          "start_offset_samples": 23,
          "duration_samples": 3
        },
        {
          "event_id": "motor-01-startup-ignored",
          "event_class": "ignored",
          "event_type": "stuck_value",
          "signal_id": "load_proxy",
          "magnitude": 0,
          "enabled": true,
          "start_offset_samples": 2,
          "duration_samples": 3
        }
      ]
    },
    {
      "layout_id": "motor-01-low-speed",
      "layout_index": 2,
      "equipment_id": "motor-01",
      "operating_mode": "low_speed",
      "mode_start_sample": 780,
      "mode_end_sample": 810,
      "events": [
        {
          "event_id": "motor-01-low-speed-machine-fault",
          "event_class": "machine_fault",
          "event_type": "jam_or_slip",
          "signal_id": "motor_current",
          "magnitude": 0.55,
          "enabled": true,
          "start_offset_samples": 16,
          "duration_samples": 3
        },
        {
          "event_id": "motor-01-low-speed-sensor-fault",
          "event_class": "sensor_fault",
          "event_type": "spike",
          "signal_id": "motor_temperature",
          "magnitude": 8,
          "enabled": true,
          "start_offset_samples": 23,
          "duration_samples": 3
        },
        {
          "event_id": "motor-01-low-speed-data-quality",
          "event_class": "data_quality",
          "event_type": "dropout",
          "signal_id": "motor_temperature",
          "magnitude": 0,
          "enabled": true,
          "start_offset_samples": 2,
          "duration_samples": 3
        },
        {
          "event_id": "motor-01-low-speed-ignored",
          "event_class": "ignored",
          "event_type": "stuck_value",
          "signal_id": "load_proxy",
          "magnitude": 0,
          "enabled": true,
          "start_offset_samples": 9,
          "duration_samples": 3
        }
      ]
    },
    {
      "layout_id": "motor-01-nominal",
      "layout_index": 3,
      "equipment_id": "motor-01",
      "operating_mode": "nominal",
      "mode_start_sample": 810,
      "mode_end_sample": 840,
      "events": [
        {
          "event_id": "motor-01-nominal-machine-fault",
          "event_class": "machine_fault",
          "event_type": "jam_or_slip",
          "signal_id": "motor_current",
          "magnitude": 0.55,
          "enabled": true,
          "start_offset_samples": 23,
          "duration_samples": 3
        },
        {
          "event_id": "motor-01-nominal-sensor-fault",
          "event_class": "sensor_fault",
          "event_type": "spike",
          "signal_id": "motor_temperature",
          "magnitude": 8,
          "enabled": true,
          "start_offset_samples": 2,
          "duration_samples": 3
        },
        {
          "event_id": "motor-01-nominal-data-quality",
          "event_class": "data_quality",
          "event_type": "dropout",
          "signal_id": "motor_temperature",
          "magnitude": 0,
          "enabled": true,
          "start_offset_samples": 9,
          "duration_samples": 3
        },
        {
          "event_id": "motor-01-nominal-ignored",
          "event_class": "ignored",
          "event_type": "stuck_value",
          "signal_id": "load_proxy",
          "magnitude": 0,
          "enabled": true,
          "start_offset_samples": 16,
          "duration_samples": 3
        }
      ]
    },
    {
      "layout_id": "motor-01-high-load",
      "layout_index": 4,
      "equipment_id": "motor-01",
      "operating_mode": "high_load",
      "mode_start_sample": 840,
      "mode_end_sample": 870,
      "events": [
        {
          "event_id": "motor-01-high-load-machine-fault",
          "event_class": "machine_fault",
          "event_type": "jam_or_slip",
          "signal_id": "motor_current",
          "magnitude": 0.55,
          "enabled": true,
          "start_offset_samples": 2,
          "duration_samples": 3
        },
        {
          "event_id": "motor-01-high-load-sensor-fault",
          "event_class": "sensor_fault",
          "event_type": "spike",
          "signal_id": "motor_temperature",
          "magnitude": 8,
          "enabled": true,
          "start_offset_samples": 9,
          "duration_samples": 3
        },
        {
          "event_id": "motor-01-high-load-data-quality",
          "event_class": "data_quality",
          "event_type": "dropout",
          "signal_id": "motor_temperature",
          "magnitude": 0,
          "enabled": true,
          "start_offset_samples": 16,
          "duration_samples": 3
        },
        {
          "event_id": "motor-01-high-load-ignored",
          "event_class": "ignored",
          "event_type": "stuck_value",
          "signal_id": "load_proxy",
          "magnitude": 0,
          "enabled": true,
          "start_offset_samples": 23,
          "duration_samples": 3
        }
      ]
    },
    {
      "layout_id": "motor-01-cooldown",
      "layout_index": 5,
      "equipment_id": "motor-01",
      "operating_mode": "cooldown",
      "mode_start_sample": 870,
      "mode_end_sample": 900,
      "events": [
        {
          "event_id": "motor-01-cooldown-machine-fault",
          "event_class": "machine_fault",
          "event_type": "jam_or_slip",
          "signal_id": "motor_current",
          "magnitude": 0.55,
          "enabled": true,
          "start_offset_samples": 9,
          "duration_samples": 3
        },
        {
          "event_id": "motor-01-cooldown-sensor-fault",
          "event_class": "sensor_fault",
          "event_type": "spike",
          "signal_id": "motor_temperature",
          "magnitude": 8,
          "enabled": true,
          "start_offset_samples": 16,
          "duration_samples": 3
        },
        {
          "event_id": "motor-01-cooldown-data-quality",
          "event_class": "data_quality",
          "event_type": "dropout",
          "signal_id": "motor_temperature",